{
  "$schema": "https://json-schema.org/draft/2020-12/schema",
  "$id": "https://journeyman.local/schemas/phase-minus-1-results.json",
  "$comment": "Pre-registration protocol v2 (additive, pre-first-experimental-run): adds the required run_kind discriminator + the harness_selftest decision constraint. See experiments/phase_minus_1/CHANGELOG.md.",
  "title": "Phase -1 Results",
  "type": "object",
  "required": ["protocol_version", "run_id", "run_kind", "started_at", "completed_at", "pins", "tasks", "aggregate", "decision"],
  "additionalProperties": false,
  "allOf": [
    {
      "$comment": "A full pass requires the mandatory control run and its delta (ADR-0017).",
      "if": {
        "required": ["decision"],
        "properties": { "decision": { "required": ["status"], "properties": { "status": { "const": "pass" } } } }
      },
      "then": {
        "properties": { "aggregate": { "required": ["control_run_present", "treatment_vs_control_delta"], "properties": { "control_run_present": { "const": true } } } }
      }
    },
    {
      "$comment": "A harness self-test can never report a pass-like decision; only run_kind=experiment makes a real decision.",
      "if": {
        "required": ["run_kind"],
        "properties": { "run_kind": { "const": "harness_selftest" } }
      },
      "then": {
        "properties": { "decision": { "properties": { "status": { "not": { "enum": ["pass", "provisional_pass"] } } } } }
      }
    }
  ],
  "properties": {
    "protocol_version": {
      "type": "string"
    },
    "run_kind": {
      "enum": ["experiment", "harness_selftest"],
      "description": "experiment = a real Phase -1 run (Run A/B over the full task set) whose decision counts; harness_selftest = a spine/smoke run that exercises the machinery and must NEVER be read as an experimental decision (T-1.4 analysis ignores it)."
    },
    "run_id": {
      "type": "string"
    },
    "started_at": {
      "type": "string",
      "format": "date-time"
    },
    "completed_at": {
      "type": "string",
      "format": "date-time"
    },
    "pins": {
      "type": "object",
      "required": ["model_ids", "effector_version", "pricing_snapshot", "cache_policy", "retrieval_config"],
      "additionalProperties": true,
      "properties": {
        "model_ids": {
          "type": "array",
          "items": { "type": "string" },
          "minItems": 1
        },
        "effector_version": { "type": "string" },
        "pricing_snapshot": { "type": "string" },
        "cache_policy": { "type": "string" },
        "retrieval_config": { "type": "string" }
      }
    },
    "tasks": {
      "type": "array",
      "minItems": 1,
      "items": {
        "type": "object",
        "required": [
          "position",
          "task_id",
          "tier",
          "total_cost_usd",
          "wall_clock_seconds",
          "dod_passed",
          "contract_passed",
          "contract_tests_passed",
          "contract_tests_total",
          "effector_retries",
          "first_pass_contract_success",
          "craft_items_retrieved",
          "craft_items_reused",
          "trace_id"
        ],
        "additionalProperties": false,
        "properties": {
          "position": { "type": "integer", "minimum": 1 },
          "task_id": { "type": "string" },
          "tier": { "enum": ["easy", "medium", "hard"] },
          "model_cost_usd": { "type": "number", "minimum": 0 },
          "effector_cost_usd": { "type": "number", "minimum": 0 },
          "total_cost_usd": { "type": "number", "minimum": 0 },
          "wall_clock_seconds": { "type": "number", "minimum": 0 },
          "dod_passed": { "type": "boolean" },
          "contract_passed": { "type": "boolean" },
          "contract_tests_passed": { "type": "integer", "minimum": 0 },
          "contract_tests_total": { "type": "integer", "minimum": 1 },
          "effector_retries": { "type": "integer", "minimum": 0 },
          "first_pass_contract_success": { "type": "boolean" },
          "craft_items_retrieved": {
            "type": "array",
            "items": { "type": "string" },
            "uniqueItems": true
          },
          "craft_items_reused": {
            "type": "array",
            "items": { "type": "string" },
            "uniqueItems": true
          },
          "human_interventions": { "type": "integer", "minimum": 0 },
          "security_events": {
            "type": "array",
            "items": { "type": "string" }
          },
          "excluded_from_slope": { "type": "boolean" },
          "exclusion_reason": { "type": "string" },
          "trace_id": { "type": "string" }
        }
      }
    },
    "aggregate": {
      "type": "object",
      "required": ["warmup_tasks", "cost_slope_after_warmup", "cost_slope_ci", "min_detectable_slope", "control_run_present", "treatment_vs_control_delta", "quality_holds", "reuse_is_real", "security_controls_held"],
      "additionalProperties": true,
      "properties": {
        "warmup_tasks": { "type": "integer", "minimum": 0 },
        "cost_slope_after_warmup": { "type": "number" },
        "cost_slope_ci": {
          "type": "array",
          "description": "[low, high] confidence interval for the slope (ADR-0017).",
          "items": { "type": "number" },
          "minItems": 2,
          "maxItems": 2
        },
        "min_detectable_slope": {
          "type": "number",
          "description": "Pre-registered effect size the run is powered to detect."
        },
        "control_run_present": {
          "type": "boolean",
          "description": "Run B (memory-disabled control) executed; must be true for a full pass."
        },
        "treatment_vs_control_delta": {
          "type": "number",
          "description": "Treatment-minus-control cost-slope delta; primary craft-attribution evidence."
        },
        "retry_slope_after_warmup": { "type": "number" },
        "quality_holds": { "type": "boolean" },
        "reuse_is_real": { "type": "boolean" },
        "security_controls_held": { "type": "boolean" }
      }
    },
    "decision": {
      "type": "object",
      "required": ["status", "rationale"],
      "additionalProperties": false,
      "properties": {
        "status": { "enum": ["pass", "provisional_pass", "fail", "invalid", "stopped"] },
        "rationale": { "type": "string" },
        "residual_risks": {
          "type": "array",
          "items": { "type": "string" }
        }
      }
    }
  }
}
